They are urging a boycott of foreign products	Mereka mengajak boikot produk asing
The child eats eagerly	Anak itu makan dengan lahap
He is indeed a badminton champion	Dia memang jawara bulu tangkis
The color of the shirt is starting to fade	Warna baju itu mulai luntur
I know the ins and outs well	Aku tahu seluk-beluknya baik
The young generation must innovate	Generasi belia harus berinovasi
The doctor diagnosed cataracts in the eye	Dokter mendiagnosis katarak mata
A thin membrane covers the lake	Selaput tipis menutupi danau
The bird flew from the cage	Burung itu terbang dari sangkar
Human anatomy is studied on campus	Anatomi manusia dipelajari di kampus
The decision is absolute	Keputusan itu bersifat absolut
The instruction is quite explicit and clear	Instruksi itu cukup eksplisit dan jelas
Big changes occur in a decade	Perubahan besar terjadi dalam dasawarsa
I make cake from sago	Saya membuat kue dari sagu
The coastal reclamation project has started	Proyek reklamasi pantai dimulai
The torque of this car engine is high	Torsi mesin mobil ini tinggi
The company chooses arbitration for dispute resolution	Perusahaan memilih arbitrase untuk penyelesaian sengketa
The company hierarchy influences work decisions	Hierarki perusahaan memengaruhi keputusan kerja
The locomotive pulls the passenger carriages	Lokomotif menarik gerbong penumpang
The little bird perched on the branch	Burung kecil hinggap di dahan
Intuition guides important decisions	Intuisi membimbing keputusan penting
Heat conduction occurs through metal	Konduksi panas terjadi melalui logam
I am learning to make warm knitting	Aku belajar membuat rajut hangat
He often complains about work	Dia sering komplain tentang pekerjaan
I dip bread into tea	Aku celup roti ke teh
I see cells with a microscope	Saya melihat sel dengan mikroskop
The prophecy made everyone surprised	Nubuat itu membuat semua terkejut
Rose petals are pink	Kelopak mawar berwarna merah muda
He writes an essay about education	Dia menulis esai tentang pendidikan
The horse needs a strong bridle	Kuda itu butuh kekang kuat
The exterior design of the house is attractive	Desain eksterior rumah itu menarik
I will edit this article	Aku akan menyunting artikel ini
The old cannon is still standing	Meriam tua itu masih berdiri
The evening sky is gray	Langit sore berwarna kelabu
He likes to do hand embroidery	Dia suka membuat sulam tangan
Bus route to the city center	Trayek bus menuju pusat kota
His philosophy of life is full of meaning	Falsafah hidupnya penuh makna
The carpenter uses a sharp chisel	Tukang kayu memakai pahat tajam
Don't forget to rinse your hair	Jangan lupa bilas rambutmu
The matrix contains unique numbers	Matriks tersebut berisi angka unik
The vein is clearly visible on the hand	Vena itu terlihat jelas di tangan
He remained silent and mute	Dia diam dan bisu terus
Persuasion techniques influence customer decisions	Teknik persuasi memengaruhi keputusan pelanggan
The fruit maturation process occurs naturally	Proses maturasi buah berlangsung alami
Every creature will surely face death	Setiap makhluk pasti menghadapi ajal
A motorcycle convoy passes through the city tonight	Konvoi motor melintasi kota malam ini
I want to travel to Bali	Aku ingin lancong ke Bali
He pronounced the triple divorce	Dia mengucapkan talak tiga
The electrical substation is severely damaged	Gardu listrik itu rusak parah
The cat scratches with its claws	Kucing itu menggores dengan cakar
Room ventilation needs to be improved	Ventilasi ruangan perlu diperbaiki
The wedding ceremony proceeded solemnly	Seremoni pernikahan berlangsung khidmat
Her face is beautiful like an angel	Wajahnya cantik seperti bidadari
The knife is sharp and pointed	Pisau itu tajam dan runcing
The disease is endemic in the area	Penyakit itu bersifat endemi di daerah tersebut
I like making funny rhymes	Aku suka membuat pantun lucu
The wedding dowry must be prepared	Mahar pernikahan harus dipersiapkan
The ancient statue attracts attention	Arca kuno itu menarik perhatian
The mountain landscape looks beautiful	Lanskap pegunungan terlihat indah
Good faith is important in work	Iktikad baik penting dalam kerja
This chart explains the work process	Bagan ini menjelaskan proses kerja
Bile helps digest fat	Empedu membantu pencernaan lemak
Discussing that topic is considered taboo	Membahas topik itu dianggap tabu
We plan to cruise next week	Kami berencana pesiar minggu depan
The government is striving to eradicate prostitution	Pemerintah berupaya memberantas prostitusi
Arabic calligraphy looks beautiful	Kaligrafi Arab terlihat indah
Comparison of the prices of this product is important	Komparasi harga produk ini penting
Assessment is needed for performance evaluation	Asesmen diperlukan untuk evaluasi kinerja
The president finally had to step down	Presiden itu akhirnya harus lengser
This device is quite reliable in operation	Perangkat ini cukup reliabel dalam operasi
The graph curve shows a sharp increase	Kurva grafik menunjukkan peningkatan tajam
The project cost calculation is complete	Kalkulasi biaya proyek sudah selesai
The battalion is ready to fight	Batalion itu siap bertempur
My gums feel very painful	Gusi saya terasa sakit sekali
I bought new powder today	Aku membeli bedak baru hari ini
Data is stored with strong encryption	Data disimpan dengan enkripsi kuat
She always looks fashionable every day	Dia selalu tampil modis setiap hari
The surface of the stone is concave	Batu itu permukaannya cekung
The vector indicates the direction of motion	Vektor itu menunjukkan arah gerak
The movie reaches an exciting climax	Film itu mencapai klimaks mendebarkan
The torch is lit in the dark night	Obor menyala di malam gelap
The dictator oppresses his people	Diktator itu menindas rakyatnya
His smile looks very cynical	Senyumnya terlihat sangat sinis
The ice cream cone is delicious	Kerucut es krim itu lezat
Introspection time is important for us	Waktu introspeksi penting bagi kita
My alma mater is the University of Indonesia	Almamaterku adalah Universitas Indonesia
My heart melts seeing you sad	Hatiku luluh melihatmu sedih
That snapper is big	Ikan kakap itu besar
The expert team conducts temple restoration	Tim ahli melakukan restorasi candi
My hand is injured because of the clutch	Tangan saya terluka karena kopling
Catalysts speed up chemical reactions	Katalis mempercepat reaksi kimia
The title of the book is interesting	Titel buku itu menarik
The paint on the wall notes is starting to peel	Catatan cat dinding mulai kelupas
The extradition process takes a long time	Proses ekstradisi memakan waktu lama
The shirt has a hole at the elbow	Kaosnya bolong di siku
The police conducted intensive interrogation of the victim	Polisi melakukan interogasi intensif korban
The car looks very old fashioned	Mobil itu terlihat lawas banget
His forehead furrowed as a sign of confusion	Keningnya berkerut tanda bingung
Generic medicine is more affordable in price	Obat generik lebih terjangkau harga
The ringing phone woke me up	Dering telepon membuatku terbangun
The pomegranate is ripe red	Buah delima itu merah matang
He tried to break down the door	Dia mencoba untuk dobrak pintu
Weather anomalies cause flooding	Anomali cuaca menyebabkan banjir
The car suddenly changed lanes	Mobil itu pindah lajur tiba-tiba
The peace pact was signed by both parties	Pakta damai diteken kedua pihak
The sun sets on the horizon	Matahari terbenam di cakrawala
Nutmeg trees grow in the garden	Pohon pala tumbuh di kebun
User preferences influence design	Preferensi pengguna mempengaruhi desain
The child suffers from goiter	Anak itu menderita gondok
The work feels monotonous all the time	Pekerjaan itu terasa monoton terus
Ancient artifacts were found at the site	Artefak kuno ditemukan di situs
Your idea is really crazy	Ide kamu benar-benar edan banget
Inflammation causes severe pain	Inflamasi menyebabkan nyeri hebat
He rose to the top of the class rankings	Dia naik rangking juara kelas
The bolt must be tightened first	Baut itu harus dikencangkan dulu
He follows the latest fashion trends	Dia mengikuti tren fesyen terbaru
I see stars with a telescope	Saya melihat bintang dengan teleskop
Customer testimonials are very helpful for decisions	Testimoni pelanggan sangat membantu keputusan
Natural fragrant sandalwood oil	Minyak cendana harum alami
The singer is very famous	Penyanyi itu sangat masyhur
The child is hiding under the table	Anak itu bersembunyi di kolong meja
Whales are large marine mammals	Paus adalah mamalia laut besar
The soldiers threw grenades at the enemy	Tentara melempar granat ke musuh
The sound of pain moans is heard softly	Rintih kesakitan terdengar pelan
His hard work has paid off	Jerih payahnya membuahkan hasil
The rice has black crust	Nasi itu ada kerak hitam
The soldier guards the stubborn border	Serdadu itu menjaga perbatasan keras kepala
He was just promoted to non-commissioned officer rank	Dia baru naik pangkat bintara
Chemical residues must be disposed of correctly	Residu kimia harus dibuang benar
His her belly is starting to look bloated	Perutnya mulai terlihat buncit
Optical illusions deceive our eyes	Ilusi optik menipu mata kita
The floor of the house is made of marble	Lantai rumahnya terbuat dari marmer
Fresh milkfish at the market	Ikan bandeng segar di pasar
This player has high caliber	Pemain ini punya kaliber tinggi
The ozone layer protects the earth	Lapisan ozon melindungi bumi
The garment factory is very large	Pabrik garmen itu besar sekali
His attitude is easily changeable unstable	Sikapnya mudah berubah labil
He ignored the teacher's warning	Dia gubris peringatan guru
The child sits in the hut	Anak itu duduk di gubuk
Please stamp this document	Tolong beri stempel dokumen ini
This bread is very stale	Roti ini sudah basi banget
The cartel controls the oil market	Kartel itu menguasai pasar minyak
The cat has striped fur	Kucing itu punya bulu belang
He carries the sharp machete	Dia membawa golok tajam itu
Numerical data helps analysis	Data numerik membantu analisis
Typical rainy season weather	Cuaca tipikal musim hujan
The symposium discusses the latest technological innovations	Simposium membahas inovasi teknologi terbaru
The supremacy of technology changes the world	Supremasi teknologi mengubah dunia
The beach experienced severe abrasion	Pantai itu mengalami abrasi parah
The technology looks primitive	Teknologi itu terlihat primitif
the necklace strand came undone	untai kalung itu terlepas
The road to the steep summit	Jalan menuju puncak terjal
The child is holding a wooden bow	Anak itu memegang busur kayu
The money suddenly disappeared yesterday	Uangnya tiba-tiba raib kemarin
Nicotine causes cigarette addiction	Nikotin menyebabkan ketergantungan rokok
This tool works with high precision	Alat ini bekerja dengan presisi tinggi
The frog jumps in the morning pond	Kodok melompat di kolam pagi
thirst after running long	dahaga setelah berlari panjang
The child is squatting near the door	Anak itu duduk jongkok dekat pintu
The film has a new sequel	Film itu memiliki sekuel baru
My legs feel sore after walking	Kaki saya terasa pegal setelah berjalan
Her hair is black and curly	Rambutnya hitam dan keriting
The child is going through puberty	Anak itu sedang mengalami puber
These chips taste very crispy	Keripik ini terasa sangat renyah
The sodium content in salt is high	Kandungan natrium dalam garam tinggi
New incoming message notification	Notifikasi pesan masuk baru
We rent a luxury limousine	Kami sewa limosin mewah
The probability of winning the lottery is small	Probabilitas menang dalam lotre kecil
Police intercept suspicious vehicle	Polisi cegat kendaraan mencurigakan
The car is parked in the depot	Mobil itu diparkir di depo
The bird is looking for a new host	Burung itu mencari inang baru
Beetles fly in the flower garden	Kumbang terbang di taman bunga
seismic activity increased sharply	aktivitas seismik meningkat tajam
This bread feels chewy and delicious	Roti ini terasa kenyal dan lezat
We send an online petition	Kami mengirim petisi online
The sound of the bird is heard loudly	Suara burung terdengar nyaring
The company gives severance pay to employees	Perusahaan memberikan pesangon kepada karyawan
Organ transplantation saves lives	Transplantasi organ menyelamatkan nyawa
The president grants clemency to the prisoner	Presiden memberikan grasi kepada narapidana
Kitchen utensils are made of silicone	Peralatan dapur terbuat dari silikon
Earthquakes occur due to fault shifts	Gempa terjadi akibat pergeseran sesar
The doctors suggestion influences the patient	Sugesti dokter mempengaruhi pasien
We are going to the disco tonight	Kami pergi ke disko malam ini
His ribs feel painful	Tulang rusuknya terasa sakit
The ocean's treasure holds valuable riches	Karun laut menyimpan harta berharga
The merchant bought many spices	Saudagar itu membeli banyak rempah
The pine forest looks fresh green	Hutan pinus terlihat hijau segar
Generalization sometimes misleads understanding	Generalisasi terkadang menyesatkan pemahaman
The aide helps in military duties	Ajudan membantu dalam tugas militer
Virgin water from the high mountains	Air perawan dari pegunungan tinggi
He remains skeptical of the promise	Dia tetap skeptis terhadap janji itu
Please scan this document quickly	Tolong pindai dokumen ini cepat
The bird perched on the fig tree	Burung itu hinggap di ara
He looks naive and innocent	Dia terlihat lugu dan polos
the smell of sulfur from the active crater	bau belerang dari kawah aktif
The foreman supervises the field workers	Mandor mengawasi pekerja lapangan
Be careful with pickpockets in the market	Hati-hati dengan copet di pasar
He uses a race jockey	Dia memakai joki lomba balap
The air in the mountains is very cool	Udara di pegunungan sangat adem
The parking is tight against the wall	Parkirannya mepet di tembok
He reads the history encyclopedia every day	Dia membaca ensiklopedia sejarah setiap hari
The clan controlled the area	Klan itu menguasai wilayah tersebut
The man's style of dressing is masculine	Gaya berpakaian pria itu maskulin
The patient is treated in the main ward	Pasien dirawat di bangsal utama
The faction competed closely in the election	Faksi itu bersaing ketat dalam pemilu
The padlock locks the house door	Gembok itu mengunci pintu rumah
I have respect for you	Saya punya respek padamu
The comet passed by tonight	Komet itu melintas malam ini
Drizzle falls in the morning	Gerimis turun saat pagi hari
He is too greedy with his food	Dia terlalu tamak makanannya
Interruption occurs during the meeting	Interupsi terjadi saat rapat berlangsung
The property valuation process is running smoothly	Proses valuasi properti berjalan lancar
The paradox is he is afraid of success	Paradoksnya, dia takut sukses
The message was sent anonymously	Pesan itu dikirim secara anonim
I see a bird with binoculars	Aku melihat burung dengan teropong
He is angry because he is late for work	Dia berang karena terlambat kerja
He often experiences severe migraines	Dia sering mengalami migrain berat
He is indeed a very stingy person	Dia memang orang pelit banget
Thermal clothing is suitable for winter	Pakaian termal cocok untuk musim dingin
Plant spores spread through the air	Spora tumbuhan menyebar melalui udara
This bluetooth speaker is portable and lightweight	Speaker bluetooth ini portabel dan ringan
Yeast is needed to make bread	Ragi diperlukan untuk membuat roti
He submitted a new legal exception	Dia mengajukan eksepsi hukum baru
Ovulation usually occurs every month	Ovulasi biasanya terjadi setiap bulan
He was treated because of typhoid	Dia dirawat karena tifus
The clitoris is a sensitive part of a woman	Klitoris adalah bagian sensitif wanita
The bunch of bananas is ripe red	Tandan pisang itu matang merah
A coconut shell broke on the road	Tempurung kelapa pecah di jalan
Paper is made from cellulose fibers	Kertas terbuat dari serat selulosa
He handled the case wisely	Dia menangani kes dengan bijak
Pull the lever to open the door	Tarik tuas untuk membuka pintu
the bird is trapped behind the bars	burung terjebak di balik jeruji
The children play the tambourine together	Anak-anak bermain rebana bersama
This chicken broth is very delicious	Kaldu ayam ini enak banget
The child has a red rash	Anak itu terkena ruam merah
He hit with a hard head	Dia memukul dengan kepal keras
The wound is discharging white pus	Luka itu mengeluarkan nanah putih
His hair is full of dandruff	Rambutnya penuh dengan ketombe
Barge carries coal load	Tongkang membawa muatan batu bara
I carry a warm hot thermos	Aku membawa termo panas hangat
The ship anchor is firmly embedded	Jangkar kapal tertancap kuat
The old mortar is full of stories	Lesung tua itu penuh cerita
The plaster sticks to my wound	Plester menempel di lukaku
Game addiction affects productivity	Adiksi game memengaruhi produktivitas
His words come back like a boomerang	Kata-katanya seperti bumerang kembali
The car chassis is strong and light	Sasis mobil itu kuat dan ringan
The dog walked limping this morning	Anjing itu berjalan pincang pagi ini
The soldiers avoid landmines	Tentara menghindari ranjau darat
Grouper fish live in the sea	Ikan kerapu hidup di laut
Patchouli plants grow well	Tanaman nilam tumbuh subur
I cook fresh stir fried mustard greens	Saya memasak tumis sawi segar
Quail eggs are delicious to eat	Telur puyuh enak dimakan
It tastes sour like an orange	Rasanya masam seperti jeruk
Elderly people need attention	Orang jompo butuh perhatian
Red lanterns decorate the highway	Lampion merah menghiasi jalan raya
Methane gas comes from swamps	Gas metana berasal rawa
He speaks with a Javanese accent	Dia berbicara dengan logat Jawa
The room felt so silent	Ruang itu terasa begitu senyap
The causal relationship between stress and health	Hubungan kausal antara stres dan kesehatan
The land looks barren and dry	Lahan itu terlihat tandus dan kering
The firm opens a new branch	Firma itu membuka cabang baru
The natural stunning beauty of the lagoon	Keindahan laguna menakjubkan alami
He is wearing a pink badge	Dia memakai lencana merah muda
The man is wearing a white turban	Pria itu memakai serban putih
The shirt looks shabby and dull	Baju itu terlihat lusuh dan kusam
The German Chancellor attends the international conference	Kanselir Jerman menghadiri konferensi internasional
They always get along with family	Mereka selalu akur bersama keluarga
I like to eat meatball offal	Saya suka makan jeroan bakso
He kept making loud grumbles	Dia terus mengeluarkan gerutu keras
The old castle attracts attention	Kastel tua itu menarik perhatian
The children laugh watching the clown	Anak-anak tertawa melihat badut
The spring is strong and flexible	Pegas itu kuat dan lentur
He remains calm in facing problems	Dia tetap kalem menghadapi masalah
The spare tire is in the trunk	Ban serep ada di bagasi
The king receives tribute from his people	Raja menerima upeti rakyatnya
Taro grows in the backyard garden	Talas tumbuh di kebun belakang
Her face looks plump and fresh	Wajahnya terlihat montok dan segar
The gecko hides on the wall	Tokek bersembunyi di dinding
The sergeant leads the troops firmly	Sersan memimpin pasukan dengan tegas
The cardinal bird is bright red	Burung kardinal berwarna merah cerah
I bought phone credit at the counter	Saya membeli pulsa di konter
The mummy was found in the pyramid	Mumi itu ditemukan di piramida
The lantern lights up the night road	Lentera menerangi jalan malam
The kitchen floor uses new tiles	Lantai dapur memakai ubin baru
Boiled cassava is suitable for snacks	Ketela rebus cocok untuk cemilan
Farmers plant sorghum in the field	Petani menanam sorgum di ladang
The necklace is adorned with beautiful emeralds	Kalung itu berhiaskan zamrud indah
The executioner waited in the court that night	Algojo menunggu di pengadilan malam itu
He is pacing back and forth in the corridor	Dia mondar-mandir di koridor
His face looks gloomy today	Wajahnya tampak muram hari ini
Chicken meat must be finely minced	Daging ayam harus dicincang halus
He studies ballet every day	Dia belajar balet setiap hari
The doctor suggests using skin ointment	Dokter menyarankan pakai salep kulit
The fabric is decorated with beautiful lace	Kain itu dihiasi renda cantik
We live in a new condominium	Kami tinggal di kondominium baru
The doctor examines the condition of the patients spleen	Dokter memeriksa kondisi limpa pasien
His identity card turned out to be fake	Kartu identitasnya ternyata gadungan
Sleep comfortably with a new mosquito net	Tidur nyaman dengan kelambu baru
The campfire is warm at night	Api unggun hangat di malam
The cat has a spotted pattern	Kucing itu memiliki pola tutul
Water flows from the bathroom sink	Air mengalir dari wastafel kamar mandi
Rumors spread in the office	Desas-desus menyebar di kantor
They met in the small chapel	Mereka bertemu di kapel kecil
I bought a new pickup truck	Saya membeli mobil pikap baru
The film is a funny parody	Film itu adalah parodi lucu
Potassium is important for heart health	Potasium penting untuk kesehatan jantung
I study about constellations	Aku belajar tentang rasi bintang
The group formed a secret cult	Kelompok itu membentuk kultus rahasia
I want to treat you to dinner	Aku mau traktir makan malam
His actions are too reckless and dangerous	Tindakannya terlalu sembrono dan berbahaya
She is wearing thick black mascara	Dia memakai maskara hitam tebal
My niece/nephew is good at playing ball	Kemenakan saya pintar bermain bola
Beautiful coral reefs in the sea	Terumbu koral indah di laut
The duchy has a long history	Kadipaten itu memiliki sejarah panjang
The king called his palace concubine	Raja memanggil selir istananya
Please get that screwdriver for me	Tolong ambilkan obeng itu
Fish breathe through red gills	Ikan bernapas melalui insang merah
A curative approach is needed immediately	Pendekatan kuratif diperlukan segera
Fresh basil leaves for salad	Daun kemangi segar untuk lalap
jellyfish swim in the sea	ubur-ubur berenang di laut
Artificial lights illuminate the room	Lampu artifisial menerangi ruangan
The crew sat inside the cockpit	Kru duduk di dalam kokpit
The rings of Saturn look beautiful	Cincin Saturnus terlihat indah
The stork flies over the rice field	Bangau terbang di atas sawah
The conductor checks the passenger's ticket	Kondektur memeriksa tiket penumpang
The mechanic repairs the broken car	Montir itu memperbaiki mobil rusak
The cowboy rides the horse fast	Koboi itu menunggang kuda cepat
Please tighten that screw	Tolong kencangkan sekrup itu
The glacier is starting to melt rapidly	Gletser itu mulai mencair cepat
The color of that shirt looks tacky	Warna baju itu terlihat norak
The Milky Way galaxy is full of beautiful stars	Galaksi Bimasakti penuh bintang indah
I need a sharp razor blade now	Aku butuh silet tajam sekarang
Moths fly at night	Ngengat terbang di malam hari
Passengers are waiting on the platform	Penumpang menunggu di peron
The columnist wrote an interesting opinion	Kolumnis itu menulis opini menarik
The doctor gives morphine for pain	Dokter memberikan morfin untuk nyeri
The corporal leads the troops firmly	Kopral memimpin pasukan dengan tegas
Workers use dynamite for blasting	Pekerja menggunakan dinamit untuk peledakan
Passengers board the emergency lifeboat	Penumpang menaiki sekoci darurat
The violin quartet performed stunningly	Kuartet biola tampil memukau
Fireflies sparkle in the night	Kunang-kunang berkilauan di malam
The tablecloth is red	Taplak meja itu berwarna merah
Seagulls fly over the sea	Camar terbang di atas laut
The planet Mercury is closest to the sun	Planet Merkurius terdekat matahari
The pendant is made of gold	Liontin itu terbuat dari emas
I like eating fried dumplings	Saya suka makan pangsit goreng
Marijuana is illegal in many countries	Mariyuana ilegal di banyak negara
I added fresh coriander	Saya menambahkan ketumbar segar
Netizens are actively commenting on the latest news	Netizen ramai komentari berita terbaru
The taste of glutamate enhances the flavor of food	Rasa glutamat meningkatkan cita rasa makanan
The planet Neptune is blue	Planet Neptunus berwarna biru
The children are playing on the ship deck	Anak-anak bermain di geladak kapal
I like to drink cold lemonade	Aku suka minum limun dingin
The fish smells really rancid	Ikan itu baunya tengik banget
I give a beautiful bouquet of flowers	Aku memberi buket bunga indah
He plays the harmonica in the park	Dia bermain harmonika di taman
We celebrate with red champagne	Kami merayakan dengan sampanye merah
She bought some new tampons	Dia membeli beberapa tampon baru
Otters build small dams	Berang-berang membangun bendungan kecil
The creaking of the machine disturbs sleep	Derit mesin itu mengganggu tidur
The kettle contains boiling water	Cerek berisi air mendidih
The child is holding a red lollipop	Anak itu memegang lolipop merah
She is wearing long black stockings	Dia memakai stoking hitam panjang
That cat's meow is very cute	Kucing itu lucu sekali meongnya
I am using a new presentation template	Saya menggunakan templat presentasi baru
He bought an expensive bottle of brandy	Dia membeli botol brendi mahal
Hadith explains the teachings of the Prophet	Hadis menjelaskan ajaran Nabi
Thank God, today is sunny	Alhamdulillah, hari ini cerah
He received a revelation this morning	Dia menerima wahyu pagi ini
Noble morals shape a strong character	Akhlak mulia membentuk karakter kuat
The argument explains Islamic law	Dalil itu menjelaskan hukum Islam
A new paradigm changes the way of thinking	Paradigma baru mengubah cara berpikir
The company requires high liquid assets	Perusahaan membutuhkan aset likuid tinggi
Studying fiqh deepens the understanding of religion	Belajar fikih memperdalam pemahaman agama
Mutual fund investment is profitable for beginners	investasi reksa dana menguntungkan bagi pemula
The doctor examines the health of the fetus	Dokter memeriksa kesehatan janin
The issuer raised its stock price	Emiten itu naik harga sahamnya
Echelon two officials attend the meeting	Pejabat eselon dua hadir rapat
Endowment land for a new mosque	Tanah wakaf untuk masjid baru
